{"id":"transport-api","name":"TransportAPI","description":"Public transport, rail, and journey data APIs.","category":"transportation","website":"https://www.transportapi.com","docs":"https://www.transportapi.com","auth":"api-key","pricing":"Free developer access and paid options vary.","status":"active","tags":["transport","rail","travel"]}