{"id":"polygon","name":"Polygon.io API","description":"Market data APIs for stocks, options, forex, and crypto.","category":"finance","website":"https://polygon.io","docs":"https://polygon.io/docs","auth":"api-key","pricing":"Free and paid plans available.","status":"active","tags":["stocks","options","markets"]}