{"id":"openstreetmap","name":"OpenStreetMap APIs","description":"Open geographic data and map-related APIs from OpenStreetMap.","category":"maps","website":"https://www.openstreetmap.org","docs":"https://wiki.openstreetmap.org/wiki/API","auth":"none","pricing":"Open data; service usage policies apply.","status":"active","tags":["maps","open-data","geography"]}