{"id":"thesportsdb","name":"TheSportsDB","description":"Sports teams, leagues, players, events, and media database API.","category":"sports","website":"https://www.thesportsdb.com","docs":"https://www.thesportsdb.com/api.php","auth":"api-key","pricing":"Free public API with optional premium access.","status":"active","tags":["sports","teams","players"]}