{"id":"mapbox","name":"Mapbox APIs","description":"Maps, geocoding, routing, navigation, and location APIs.","category":"maps","website":"https://www.mapbox.com","docs":"https://docs.mapbox.com/api","auth":"api-key","pricing":"Free tier and usage-based plans available.","status":"active","tags":["maps","routing","geocoding"]}