{"id":"open-meteo","name":"Open-Meteo","description":"Open weather APIs providing forecasts and historical weather data.","category":"weather","website":"https://open-meteo.com","docs":"https://open-meteo.com/en/docs","auth":"none","pricing":"Free for non-commercial use; commercial terms apply for higher-volume use.","status":"active","tags":["weather","forecast","climate"]}
