{"id":"mealdb","name":"TheMealDB","description":"Open recipe and meal database API with images, ingredients, categories, and areas.","category":"food","website":"https://www.themealdb.com","docs":"https://www.themealdb.com/api.php","auth":"api-key","pricing":"Free public API with optional paid supporter features.","status":"active","tags":["food","recipes","meals"]}
