{"id":"bitly","name":"Bitly API","description":"URL shortening, links, QR codes, and link-management APIs.","category":"url","website":"https://bitly.com","docs":"https://dev.bitly.com","auth":"bearer","pricing":"Free and paid plans available.","status":"active","tags":["url-shortener","links","qr"]}