{"id":"spotify","name":"Spotify Web API","description":"API for accessing Spotify catalog metadata, playlists, users, playback, and recommendations.","category":"music","website":"https://developer.spotify.com","docs":"https://developer.spotify.com/documentation/web-api","auth":"oauth2","pricing":"Developer access subject to Spotify platform terms and limits.","status":"active","tags":["music","audio","playlists"]}
