{"id":"rawg","name":"RAWG Video Games Database API","description":"Video game discovery, metadata, platforms, genres, and screenshots API.","category":"games","website":"https://rawg.io","docs":"https://rawg.io/apidocs","auth":"api-key","pricing":"Free developer tier subject to terms.","status":"active","tags":["games","metadata","discovery"]}