{"id":"finnhub","name":"Finnhub API","description":"Real-time and historical financial market data API.","category":"finance","website":"https://finnhub.io","docs":"https://finnhub.io/docs/api","auth":"api-key","pricing":"Free tier and paid plans available.","status":"active","tags":["stocks","finance","markets"]}