{"id":"jsonplaceholder","name":"JSONPlaceholder","description":"Fake REST API for testing and prototyping without a backend.","category":"testing","website":"https://jsonplaceholder.typicode.com","docs":"https://jsonplaceholder.typicode.com/guide/","auth":"none","pricing":"Free.","status":"active","tags":["testing","mock-api","prototyping"]}
