{"id":"resend","name":"Resend API","description":"Developer-focused transactional email API.","category":"email","website":"https://resend.com","docs":"https://resend.com/docs","auth":"api-key","pricing":"Free tier and paid plans available.","status":"active","tags":["email","transactional","developers"]}